Property ID,Property Type,Location,Price,Size,Status
101,Bungalow 4BHK,"Sydney, New South Wales, Australia. The property is situated in a quiet suburban area with a beautiful park nearby. The park features a large playground for children, a basketball court, and a walking trail that offers a serene escape from the hustle and bustle of city life. The property itself is a stunning example of modern Australian architecture, with large windows that allow for an abundance of natural light to pour in. The interior design is sleek and sophisticated, with high ceilings and polished wooden floors. The living area is spacious and airy, with a large kitchen that is perfect for entertaining. The property also features a spacious backyard with a patio area, perfect for outdoor dining and entertaining. The location is highly sought after, with easy access to public transport, schools, and shopping centers.",850000,250,Available
1001,Bungalow 5BHK,"Settlers' Crescent, Coorparoo, Brisbane, Queensland, Australia.
This is a stunning 5-bedroom bungalow situated in a quiet, family-friendly neighborhood. The property boasts a spacious open-plan living area, perfect for entertaining, and a beautifully landscaped backyard ideal for alfresco dining. With its prime location, you'll be just minutes from the city centre, schools, and local amenities.",925000,400,Available
1001,Bungalow 5BHK,"Located in the heart of Sydney, the iconic Bondi Beach is just a short stroll away. The picturesque views of the ocean and the sound of the waves crashing against the shore create a serene atmosphere. The property is situated in a quiet neighborhood, surrounded by lush greenery and a variety of wildlife. The area is also home to a range of local cafes, restaurants, and shops, making it the perfect blend of tranquility and convenience. The property itself is a stunning example of modern Australian architecture, with large windows, high ceilings, and an open-plan living area that flows seamlessly into the outdoor spaces. The kitchen is fully equipped with high-end appliances and plenty of storage space. The five bedrooms are spacious and well-appointed, with built-in wardrobes and large windows that let in plenty of natural light. The property also features a large backyard, perfect for entertaining or simply enjoying the outdoors. With its unique blend of style, comfort, and location, this property is a rare find in the Australian real estate market.",825000,350,Available
7,Bungalow 5BHK,"1 Willow Street, Lilyfield NSW 2040, Australia. This property is situated in a quiet, family-friendly neighborhood with a mix of old and new homes. It's a short walk to the local park and the nearby shops and cafes. The area is also close to the city, with easy access to public transportation. The property itself is a beautiful bungalow with a spacious backyard and a large garage. It's perfect for a growing family or someone looking for a peaceful retreat from the hustle and bustle of city life. The property is fully fenced and has a secure gate. The backyard is fully landscaped and has a large patio area perfect for entertaining. The property also has a large shed and a separate laundry room. The interior of the property is bright and airy with large windows and high ceilings. The kitchen is fully equipped with modern appliances and plenty of storage space. The bedrooms are spacious and have built-in wardrobes. The bathroom is modern and has a separate shower and bathtub. The property is fully double glazed and has a secure alarm system. It's a must-see for anyone looking for a beautiful and spacious bungalow in a great location.",825000,240,Available
1,Bungalow 5BHK,"Melbourne, Australia is known for its vibrant cultural scene, with a wide range of art galleries and museums. The city is home to the National Gallery of Victoria, which features a collection of Australian and international art. Melbourne is also famous for its street art, with laneways and streets filled with vibrant murals and graffiti. The city's cultural calendar is filled with festivals and events throughout the year, including the Melbourne International Comedy Festival and the Melbourne Fringe Festival. In addition to its cultural attractions, Melbourne is also a hub for food and coffee lovers, with a wide range of restaurants and cafes serving up everything from traditional Australian cuisine to international flavors. The city's coffee culture is particularly famous, with Melbourne being home to some of the world's best coffee shops.",850000,200,Available
7,Bungalow 5BHK,"Marrickville, New South Wales, Australia. The suburb is known for its rich cultural heritage and vibrant community. Located in the Inner West region of Sydney, Marrickville is home to a diverse range of cafes, restaurants, and shops. The area is also famous for its street art, with many buildings featuring murals and graffiti. Marrickville is a popular destination for tourists and locals alike, offering a unique blend of history, culture, and entertainment. The suburb has a strong sense of community, with many residents actively involved in local events and initiatives. Marrickville is also known for its beautiful parks and gardens, including the popular Marrickville Park and the historic Marrickville Golf Course. With its rich history, cultural attractions, and natural beauty, Marrickville is a must-visit destination in Sydney.",825000,320,Available
2,Bungalow 5BHK,"Sydney, New South Wales, Australia
The location offers a serene and peaceful atmosphere, surrounded by lush greenery and picturesque views of the surrounding landscape.
It is a perfect spot for those seeking a tranquil retreat from the hustle and bustle of city life.
Residents can enjoy a range of outdoor activities, including hiking, fishing, and picnicking.
Additionally, the location is close to several amenities, including a supermarket, a post office, and a local school.",850000,2500,Available
7,Bungalow 5BHK,"Perth, the capital of Western Australia, is a beautiful city surrounded by scenic beaches, vibrant cultural attractions, and a thriving food scene. From the iconic Cottesloe Beach to the historic Kings Park and Botanic Garden, Perth has something for everyone. The city is also home to a number of world-class museums, including the Art Gallery of Western Australia and the Western Australian Museum. With its warm climate and stunning natural surroundings, Perth is the perfect destination for anyone looking to relax and unwind. The city has a population of around 2 million people and is known for its friendly and welcoming community. Visitors can enjoy a range of activities, including surfing, snorkeling, and hiking, or simply take in the breathtaking views of the Indian Ocean. Whether you're looking for adventure, culture, or relaxation, Perth has it all.",AUD 850000,450,Available
101,Bungalow 5BHK,"The picturesque town of Margaret River, situated in the southwest of Western Australia, is known for its pristine beaches and world-class surf breaks. The region's unique landscape is dotted with limestone cliffs, pristine rivers, and ancient forests. Margaret River is a haven for outdoor enthusiasts, with activities ranging from surfing and snorkeling to hiking and wildlife spotting. The area's rich cultural heritage is also reflected in its numerous art galleries, wineries, and museums.",525000,2500,Available
2,Bungalow 5BHK,"Melbourne, Australia. Melbourne is a city in the state of Victoria, Australia. It is known for its cultural institutions, such as the National Gallery of Victoria and the State Theatre. The city is also home to many parks and gardens, including the Royal Botanic Gardens and the Fitzroy Gardens. Melbourne is a popular tourist destination, attracting visitors from all over the world. It has a diverse range of restaurants, cafes, and bars, and is known for its vibrant street art scene. The city is also home to many universities and research institutions, including the University of Melbourne and Monash University.",AUD 1200000,250,Available
10001,Bungalow 5BHK,"The picturesque coastal town of Byron Bay in New South Wales, Australia, is known for its stunning beaches, vibrant arts scene, and the iconic Cape Byron Lighthouse, which is the easternmost point of Australia. It's a popular destination for surfers, families, and those seeking a relaxing getaway. Byron Bay is also famous for its whale watching tours, dolphin spotting, and the chance to see humpback whales on their annual migration. Visitors can enjoy a variety of outdoor activities, including surfing, snorkeling, and hiking through the nearby rainforests. Byron Bay has a thriving community of artists, musicians, and farmers, making it an excellent spot for those interested in alternative lifestyles. The town has a strong focus on sustainability, with many eco-friendly cafes and shops. Byron Bay is a must-visit destination for anyone looking to experience the best of Australia's coastal lifestyle.",950000,2500,Available
1,Bungalow 5BHK,"Melbourne's historic Docklands area, with its picturesque waterfront, vibrant arts scene, and trendy restaurants, is a haven for those seeking a cosmopolitan lifestyle. The area is also home to several parks and gardens, including the popular Docklands Park, which offers stunning views of the city skyline. With its unique blend of modern architecture and historic charm, Melbourne's Docklands is an attractive destination for those looking to buy a property.",525000,200,Available
1001,Bungalow 4BHK,"Sydney, New South Wales, Australia. Located in the heart of the city, with a stunning view of the harbour. The property boasts modern amenities, including a rooftop pool and a gym. It's the perfect place for those who want to experience the urban lifestyle. The area is known for its vibrant culture, with a variety of restaurants, cafes, and shops within walking distance. The property is surrounded by beautiful parks and gardens, making it an ideal place to relax and unwind. Whether you're looking for a place to call home or an investment opportunity, this property is sure to impress. The property is situated on a quiet street, with a secure entry system and ample parking. It's the perfect blend of convenience and luxury. The interior design is modern and sleek, with high ceilings and large windows that let in plenty of natural light. The property has three spacious bedrooms, each with its own en-suite bathroom. The master bedroom has a large walk-in wardrobe and a private balcony with stunning views of the city. The kitchen is fully equipped with modern appliances and plenty of storage space. The property also features a separate laundry room and a powder room. It's the perfect place to call home, whether you're a professional or a family. The property is close to public transportation, making it easy to get around the city. It's also close to major shopping centers and entertainment venues. Whether you're looking for a place to live or an investment opportunity, this property is sure to impress. The property has been well-maintained and is in excellent condition. It's a must-see for anyone looking for a luxurious lifestyle in the heart of the city.",850000,2500,Available
P00123,Bungalow 5BHK,"Melbourne, Australia - The city is known for its cultural diversity, with people from various ethnic backgrounds calling it home. From the vibrant streets of Fitzroy to the trendy cafes of Carlton, Melbourne is a city that is always on the move. With its rich history, cultural attractions, and world-class restaurants, Melbourne is a city that has something for everyone. Whether you're a foodie, an art lover, or an adventure seeker, Melbourne is the perfect place to call home. ",AUD 950000,250,Available
1,Bungalow 5BHK,"Melbourne, Victoria, Australia - The city is situated on the southern coast of the Australian mainland, and is known for its cultural diversity and world-class sporting events. The city has a rich history, dating back to the early 19th century when it was a major port for the British Empire. Today, Melbourne is a thriving metropolis with a strong economy and a high standard of living. The city is home to many famous landmarks, including the Melbourne Cricket Ground, the National Gallery of Victoria, and the Royal Botanic Gardens. Visitors to the city can enjoy a wide range of activities, including shopping, dining, and entertainment options, as well as exploring the city's many cultural attractions.",850000,250,Available
1,Bungalow 4BHK,"Sydney, New South Wales, Australia. Located in the heart of the city, this property offers breathtaking views of the iconic Opera House and Harbour Bridge. The scenic coastal walk is just a stone's throw away, and the bustling city centre is within walking distance. The property itself is a stunning example of modern Australian architecture, with sleek lines, large windows, and a spacious interior. The open-plan living area is perfect for entertaining, and the well-equipped kitchen is ideal for cooking up a storm. With four spacious bedrooms and three bathrooms, this property is the epitome of luxury living. Whether you're a busy professional or a family looking for a comfortable home, this property has it all.",850000,250,Available
12345,Bungalow 5BHK,"Melbourne, Victoria, Australia. Melbourne is the state capital of Victoria and the second-most populous city in Australia. It is located on the large natural bay of Port Phillip and is home to many cultural attractions, parks, and gardens. Melbourne has a rich history dating back to the early 19th century and has been shaped by its European, Asian, and Indigenous influences. Its diverse neighborhoods, such as Fitzroy, Carlton, and St Kilda, offer a unique blend of Victorian-era architecture, boutique shopping, and a vibrant arts scene. Visitors can explore the city's iconic landmarks, including the Royal Botanic Gardens, the Melbourne Cricket Ground, and the National Gallery of Victoria. Melbourne is also known for its coffee culture, with a plethora of cafes and coffee shops serving up some of the world's best coffee. The city's culinary scene is equally impressive, with a wide range of restaurants serving everything from traditional Australian cuisine to international flavors. Whether you're interested in history, culture, food, or entertainment, Melbourne has something for everyone.",850000,250,Available
2,Bungalow 5BHK,"Melbourne, Australia, with its vibrant cultural scene and scenic coastline, offers a unique blend of urban and natural attractions. Visitors can explore the city's famous street art, visit the Royal Botanic Gardens, or take a stroll along the Yarra River. For those seeking adventure, the nearby Dandenong Ranges offer hiking trails, scenic views, and picturesque villages to discover. The city's diverse food scene is also a highlight, with a wide range of international cuisines available.",850000,250,Available
1001,Bungalow 5BHK,"89 Victoria Parade, Fitzroy, Victoria 3065, Australia. Located in the heart of Melbourne, this 5-bedroom bungalow boasts stunning views of the city skyline. The property features high ceilings, large windows, and a spacious open-plan living area. With its prime location and luxurious finishes, this bungalow is perfect for those seeking a sophisticated lifestyle. The property also offers a private garden and a two-car garage, providing ample parking and storage space. In addition, the property is close to public transportation, shopping centers, and restaurants, making it an ideal choice for those who value convenience and accessibility. Furthermore, the property has a high energy efficiency rating, making it an eco-friendly option for environmentally conscious buyers. The property is available for viewing by appointment only and is priced at $1200000. The property is 250 square meters in size and is available for sale.",1200000,250,Available
1,Bungalow 5BHK,"Sydney's Northern Beaches, New South Wales, Australia. The area is known for its laid-back surf culture, pristine beaches, and a strong sense of community. Residents can enjoy a range of outdoor activities, from surfing and swimming to bushwalking and cycling. The area is also home to a variety of local cafes, restaurants, and shops, making it an ideal place to live for those who want to be close to nature and still have access to modern amenities. With its stunning coastal scenery, mild climate, and relaxed atmosphere, Sydney's Northern Beaches is a popular destination for both locals and tourists alike. The area is also well-connected to the rest of Sydney, with regular public transportation links to the city centre and other surrounding suburbs. Whether you're looking for a place to call home or just want to visit, Sydney's Northern Beaches has something for everyone.",825000,420,Available
10001,Bungalow 4BHK,"The scenic town of Byron Bay, New South Wales, Australia is nestled in the northeastern corner of the country, known for its beautiful beaches and vibrant cultural scene. Byron Bay is a popular tourist destination, attracting visitors from all over the world. The town's laid-back atmosphere, stunning natural beauty, and diverse community make it an ideal place to live and visit.",825000,350,Available
1001,Bungalow 5BHK,"The picturesque coastal town of Byron Bay, situated in the northern part of New South Wales, Australia. With its pristine beaches, lush rainforests, and vibrant cultural scene, Byron Bay has become a popular destination for tourists and locals alike. The town's laid-back atmosphere and stunning natural beauty make it the perfect place to relax and unwind. Byron Bay is also known for its alternative culture, with a thriving community of artists, musicians, and wellness practitioners. Visitors can enjoy a range of activities, including surfing, whale watching, and visiting the iconic Cape Byron Lighthouse. With its unique blend of natural beauty and alternative culture, Byron Bay is a must-visit destination for anyone looking to experience the best of Australia.",850000,350,Available
1234,Bungalow 5BHK,"The iconic Sydney Opera House is situated in Sydney Harbour, which is a key location in Australia. The area is known for its stunning views of the harbour and the iconic Opera House itself. The harbour is also home to numerous parks and gardens, including the Royal Botanic Garden and Mrs. Macquarie's Chair, a scenic lookout point. The area is well-connected to the rest of the city, with several public transportation options available, including buses and trains.",850000,2400,Available
1,Bungalow 5BHK,"Sydney's affluent suburb of Rose Bay, with its picturesque waterfront and stunning views of the Sydney Harbour Bridge, is a highly sought-after location for those seeking luxury and exclusivity.",1420000,225,Available
1001,Bungalow 5BHK,"Melbourne, Victoria, Australia. Melbourne is a city located in the southeastern part of Australia, known for its cultural institutions, restaurants, and street art. The city is situated on the Yarra River and is home to many parks and gardens, including the Royal Botanic Gardens. Melbourne is also known for its coffee culture and is often referred to as the coffee capital of Australia. The city has a population of over 5 million people and is a major hub for business, education, and the arts. Melbourne is home to many universities and institutions, including the University of Melbourne and Monash University.",850000,2000,Available
1001,Bungalow 5BHK,"The beautiful coastal town of Byron Bay, situated in the north-eastern corner of New South Wales, is a haven for those seeking a relaxed and peaceful lifestyle. Byron Bay is surrounded by stunning beaches, lush rainforests, and rolling hills, making it an ideal destination for nature lovers and adventure seekers alike. The town has a strong focus on the arts, with numerous galleries, studios, and festivals throughout the year. Byron Bay is also home to the famous Cape Byron Lighthouse, the easternmost point of Australia, which offers breathtaking views of the surrounding coastline.",850000,2500,Available
AUS-00002,Bungalow 4BHK,"Perth, Western Australia. Perth is a vibrant and culturally rich city with a stunning coastline. It boasts some of the world's most beautiful beaches, including Cottesloe Beach and Scarborough Beach. The city is also home to the famous Kings Park and Botanic Garden, which is one of the largest inner-city parks in the world. Visitors can explore the city's many museums and galleries, or take a stroll along the Swan River. The city's food scene is also thriving, with a wide range of restaurants serving everything from fresh seafood to international cuisine. Whether you're looking for adventure, relaxation, or cultural experiences, Perth has something for everyone.",AUD 1200000,250,Available
2,Bungalow 5BHK,"Located in the heart of Sydney, Australia, this property boasts breathtaking views of the iconic Opera House and Harbour Bridge. The stunning architecture and sleek design make it a perfect blend of modernity and elegance. The expansive backyard is perfect for hosting barbecues and outdoor gatherings, while the spacious living areas are ideal for relaxing and entertaining. The location is also close to many top-rated schools, restaurants, and shopping centers, making it a highly sought-after address.",1250000,2500,Available
1,Bungalow 5BHK,"123 Main Street, Sydney, Australia. Located in a quiet neighborhood, this 5-bedroom bungalow offers a serene atmosphere and ample space for relaxation. The interior design is modern and stylish, with large windows allowing plenty of natural light to pour in. The backyard is well-manicured and perfect for outdoor entertaining. With its prime location and excellent amenities, this property is ideal for families and professionals alike. The area is close to public transportation, schools, and shopping centers, making it a convenient choice for those who want to be connected to the city while still enjoying a peaceful lifestyle. Furthermore, the property has a spacious living area, a fully-equipped kitchen, and a dedicated home office. The bedrooms are spacious and well-appointed, with built-in wardrobes and ample storage space. The property also features a double garage and a separate laundry area. With its excellent condition and desirable location, this property is sure to impress.",850000,250,Available
1,Bungalow 4BHK,"3-5 Morrison Street, Paddington, New South Wales 2021, Australia. The area is known for its beautiful Victorian-era homes and picturesque streets. The neighborhood is close to public transportation, shopping centers, and parks. It has a mix of old and new buildings, with a strong sense of community. The local schools are highly rated, and the area is popular with families and young professionals.",825000,250,Available
1001,Bungalow 5BHK,"In the picturesque town of Katoomba, nestled in the heart of the Blue Mountains, where the rugged landscape and scenic views will leave you in awe. This charming town is a haven for nature lovers, with its proximity to the Three Sisters rock formation, the scenic Cliff Walk, and the picturesque Leura village. The area is also home to the famous Scenic World, which offers breathtaking views of the Jamison Valley. With its rich history, cultural attractions, and stunning natural beauty, Katoomba is the perfect destination for those seeking a tranquil retreat from the hustle and bustle of city life.",AUD 850000,250,Available
1001,Bungalow 4BHK,"Perth, Western Australia - 2/123 Smith St, East Victoria Park WA 6101. The area is known for its vibrant atmosphere, with a mix of cafes, restaurants, and shops. It is also close to the city centre, with easy access to public transportation. The property itself is situated on a quiet street, with a private backyard and a large living area. The neighborhood is family-friendly, with a community garden and a local park nearby. Residents can enjoy the nearby River, which offers beautiful views and a peaceful escape from the city. The area is also home to a variety of cultural events and festivals throughout the year, celebrating the city's diverse heritage.",525000,200,Available
2,Bungalow 5BHK,"Perth, Western Australia, a vibrant city known for its scenic coastline, parks, and world-class museums. The city's central business district is home to many iconic landmarks, including the Perth Town Hall and St. George's Cathedral. Perth's cultural scene is also thriving, with numerous art galleries, museums, and performance venues. Visitors can enjoy the city's beautiful beaches, scenic parks, and the stunning Kings Park and Botanic Garden. The city is also close to several major wineries and is a popular destination for food and wine enthusiasts. The climate is generally warm and sunny, making it an ideal place to live and work. With its strong economy, diverse community, and high standard of living, Perth is an attractive destination for people from all over the world. The city offers a unique blend of urban and outdoor living, making it an excellent choice for those who want to experience the best of Australia's lifestyle.",850000,2300,Available
101,Bungalow 5BHK,"A beautiful, serene property located at 123 Beachside Drive, Byron Bay, New South Wales, Australia. The property has a stunning ocean view and is surrounded by lush greenery. It has a spacious living area, a well-equipped kitchen, and five large bedrooms. The house is perfect for a family or a group of friends looking for a relaxing getaway. The nearby beaches and scenic coastal walks make it an ideal location for nature lovers. The property has a total area of 500 square meters and is available for sale at $1200000.",1200000.00,500,Available
