Property ID,Property Type,Location,Price,Size,Status
P0000017,Bungalow 3BHK,"Perth, a city in Western Australia, known for its stunning beaches and vibrant cultural scene. The city has a rich history, with many historic buildings and landmarks, such as the Perth Town Hall and the Old Mill. Perth is also home to many parks and gardens, including the beautiful Kings Park and Botanic Garden, which offers stunning views of the city and the surrounding landscape. The city has a diverse economy, with major industries including mining, oil and gas, and tourism. Perth is a popular destination for tourists, with many attractions, such as the Perth Zoo, the Art Gallery of Western Australia, and the Perth Mint.",850000,160,Available
2,Bungalow 5BHK,"The picturesque town of Byron Bay in New South Wales, Australia, boasts a stunning coastline and a vibrant arts scene. It's a popular destination for surfers and beach lovers alike. The town's laid-back atmosphere and stunning natural beauty make it an ideal place to relax and unwind. Byron Bay is surrounded by lush rainforests, scenic hiking trails, and picturesque villages. The town's main street is lined with boutique shops, cafes, and restaurants, offering a unique shopping and dining experience. Byron Bay is a must-visit destination for anyone looking to experience the best of Australia's coastal towns.",825000,245,Available
1001,Bungalow 5BHK,"Located in the picturesque coastal town of Byron Bay, New South Wales, Australia. Byron Bay is a charming beachside town known for its beautiful beaches, lush rainforests, and vibrant cultural scene. With a rich history dating back to the early 19th century, Byron Bay has evolved into a popular tourist destination, attracting visitors from all over the world. The town's laid-back atmosphere, stunning natural beauty, and diverse range of activities make it an ideal place to live, work, and play. From surfing and snorkeling to hiking and whale watching, there's something for everyone in Byron Bay. Whether you're looking for a relaxing beach vacation or an action-packed adventure, Byron Bay has it all.",825000,245,Available
1001,Bungalow 5BHK,"Sydney's trendy inner-city suburb of Paddington, known for its beautiful Victorian-era architecture, boutique shopping, and vibrant cultural scene. This cosmopolitan area is a popular destination for tourists and locals alike, offering a diverse range of dining options, from high-end restaurants to casual cafes and eateries. With its stunning views of the Sydney Opera House and Harbour Bridge, Paddington is a must-visit destination for anyone looking to experience the best of Sydney's lifestyle and culture.",825000,230,Available
1001,Bungalow 5BHK,"Sydney's historic suburb of The Rocks, with its cobblestone streets and 19th-century sandstone buildings, is a popular destination for tourists and locals alike. The area is filled with boutique shops, restaurants, and bars, making it a vibrant and exciting place to visit. The Rocks is also home to the Museum of Contemporary Art, which features an impressive collection of modern and contemporary art. Visitors can explore the area's rich history and culture by taking a guided tour or wandering through the streets on their own.",850000,240,Available
12345,Bungalow 5BHK,"New South Wales, Australia - The picturesque town of Leura, nestled in the heart of the Blue Mountains, is a haven for nature lovers and those seeking a tranquil retreat from the hustle and bustle of city life. This charming town is surrounded by breathtaking scenery, with rolling hills, verdant forests, and sparkling waterfalls. Visitors can explore the town's quaint shops, cafes, and restaurants, or take a scenic drive along the winding roads that offer stunning views of the surrounding landscape. Leura is also home to the famous Leura Mall, a historic pedestrian shopping street lined with beautiful gardens, antique shops, and art galleries. Whether you're looking to relax, unwind, or explore the great outdoors, Leura is the perfect destination for anyone seeking a unique and unforgettable experience.",850000,250,Available
1,Bungalow 5BHK,"The scenic coastal town of Byron Bay, New South Wales, Australia, known for its laid-back surfer vibe, beautiful beaches, and lush rainforests. Nestled in a quiet cul-de-sac, this stunning property boasts a spacious backyard perfect for outdoor entertaining and a short walk to the town centre. Byron Bay's famous Main Beach is just a 10-minute drive away, offering a range of cafes, restaurants, and shopping options. The property's proximity to the beach and surrounding natural beauty makes it an ideal location for those seeking a relaxed coastal lifestyle.",825000,345,Available
1,Bungalow 5BHK,"Perth, Western Australia, is known for its scenic views of the Swan River. The city's central business district is a hub of activity, with a mix of modern skyscrapers and historic buildings. The city's cultural scene is also thriving, with numerous museums, galleries, and performance venues. The city's food scene is also diverse, with a wide range of cuisines to choose from, including Asian, Italian, and Middle Eastern. Perth is also home to a number of beautiful beaches, including Cottesloe Beach and Scarborough Beach, which are popular spots for swimming, sunbathing, and surfing. The city's surrounding hills and countryside offer opportunities for hiking, cycling, and horse riding.",825000,450,Available
7,Bungalow 5BHK,"123 Sydney Street, New South Wales, Australia. Located in the heart of the city, this property offers breathtaking views of the harbour. It is a 5-bedroom, 4-bathroom house with a spacious living area and a fully equipped kitchen. The property is surrounded by lush greenery and has a private garden perfect for relaxation. The area is known for its vibrant culture, with numerous restaurants, cafes, and shops within walking distance. Residents can also enjoy the nearby parks and beaches, making it an ideal location for families and professionals alike. The property is a short drive from the city centre and has easy access to public transportation, making it convenient for commuters.",850000,2500,Available
1,Bungalow 5BHK,"Sydney's prestigious Northern Beaches, where the stunning views of the Pacific Ocean and the laid-back atmosphere create the perfect blend of relaxation and excitement. Located in the heart of the beachside suburb of Avalon, this property boasts an expansive backyard, ideal for outdoor entertaining and alfresco dining. The interior design is modern and sleek, with an emphasis on functionality and comfort. The property is situated within walking distance to the local shops and restaurants, making it an ideal choice for those seeking a convenient and luxurious lifestyle.

The property features a spacious open-plan living area, complete with a large kitchen and dining area. The kitchen is equipped with high-end appliances and ample storage space. The property also boasts a generous master bedroom with an en-suite bathroom and a large walk-in wardrobe. The property is situated on a large block of land, providing ample space for a pool, garden, and outdoor living areas. The property is perfect for those seeking a luxurious and relaxing lifestyle, with easy access to the city and the beach.",825000,450,Available
2,Bungalow 5BHK,"The picturesque town of Katoomba in the Blue Mountains region of New South Wales, Australia, is known for its breathtaking scenery and outdoor activities. Located near the Three Sisters rock formation, Katoomba is a popular destination for tourists and locals alike. Visitors can enjoy hiking, rock climbing, and scenic views of the Jamison Valley. The town also has a range of accommodation options, from luxury hotels to budget-friendly hostels. In addition to its natural beauty, Katoomba has a rich cultural heritage, with a number of historic buildings and museums to explore. Whether you're looking for adventure, relaxation, or cultural experiences, Katoomba has something for everyone. With its stunning scenery and diverse attractions, Katoomba is a must-visit destination in Australia.",525000,200,Available
2,Bungalow 5BHK,"The property is located in the picturesque town of Margaret River, Western Australia, amidst the stunning scenery of the Margaret River region. This region is renowned for its world-class surf beaches, pristine rivers, and dense forests. The area is also known for its rich cultural heritage, with a strong focus on arts, crafts, and food. The climate is mild, with warm summers and cool winters, making it an ideal location for people who love the outdoors. With its natural beauty, rich culture, and relaxed atmosphere, Margaret River is the perfect place to call home.",825000,350,Available
PID_00001,Bungalow 5BHK,"Melbourne, Victoria. Melbourne is the second-largest city in Australia, with a population of over 4.9 million residents. Located in the southeastern part of the country, Melbourne is known for its cultural diversity, with over 30% of its residents born overseas. The city is home to a range of popular attractions, including the Royal Botanic Gardens, the National Gallery of Victoria, and the Melbourne Cricket Ground. Melbourne is also known for its vibrant arts and cultural scene, with numerous galleries, museums, and performance venues throughout the city. The city has a thriving food scene, with a range of international cuisines available, from traditional Australian fare to Asian, Italian, and Middle Eastern cuisine. Melbourne is also home to many universities and research institutions, including the University of Melbourne and Monash University. The city has a strong economy, with major industries including finance, healthcare, education, and technology. Melbourne is also known for its liveability, with a high quality of life and a range of amenities and services available to residents.",AUD 2500000,420,Available
100,Bungalow 4BHK,"The picturesque town of Margaret River in Western Australia, known for its pristine beaches, rolling vineyards and lush forests. Margaret River is a popular destination for surfers, beachgoers and nature lovers alike, with its stunning coastline offering a variety of activities such as surfing, whale watching and snorkelling. The town is also famous for its world-class wineries and gourmet food scene, with many award-winning restaurants and cafes serving up fresh local produce. Whether you're looking for adventure, relaxation or simply a taste of the good life, Margaret River has something for everyone.",825000,450,Available
2,Bungalow 4BHK,"The property is situated in the picturesque suburb of Mosman, overlooking the serene waters of Middle Harbour. The area is known for its natural beauty, with lush bushlands and scenic walking trails. The property itself is nestled in a quiet cul-de-sac, providing a peaceful retreat from the hustle and bustle of city life. The local community is tight-knit, with a strong sense of camaraderie and a vibrant cultural scene. The nearby Spit Bridge offers stunning views of the harbour and is a popular spot for picnics and barbecues.",825000,200,Available
7,Bungalow 5BHK,"Sydney's picturesque Northern Beaches, where the ocean meets the lush greenery of the Ku-ring-gai Chase National Park, offering a serene and picturesque setting for a tranquil retreat. The area boasts an array of scenic lookouts, pristine beaches, and a thriving local community. With its unique blend of natural beauty and urban convenience, this location is an ideal choice for those seeking a relaxed and peaceful lifestyle. From the moment you step into this stunning property, you'll be surrounded by the sights and sounds of the great outdoors, with the soothing sounds of the ocean waves and the songs of native birds creating a sense of tranquility and calm. Whether you're looking to unwind after a long day, or simply want to escape the hustle and bustle of city life, this property has everything you need to relax and rejuvenate. The property itself is a masterpiece of modern design, with its sleek lines, spacious interior, and generous outdoor living areas creating a sense of space and freedom. With its perfect blend of style, comfort, and natural beauty, this property is sure to capture your heart and become your dream home.",950000,250,Available
PID_1002,Bungalow 4BHK,"Melbourne, Australia, situated in the heart of the city, near popular shopping districts, restaurants, and cafes. The area is known for its vibrant culture, stunning architecture, and breathtaking views of the city skyline. It's a popular destination for tourists and locals alike, offering a unique blend of history, art, and entertainment. The neighborhood is also home to several parks and gardens, providing a peaceful escape from the hustle and bustle of city life. With its rich history, cultural attractions, and modern amenities, Melbourne is a must-visit destination for anyone interested in exploring the best of Australia.",AUD 850000,250,Available
1,Bungalow 5BHK,"Sydney's trendy Inner West, nestled between the bustling suburbs of Leichhardt and Balmain, offering a unique blend of urban convenience and laid-back charm. The area is renowned for its eclectic mix of Victorian-era homes, converted warehouses, and modern apartment complexes. Residents can stroll along the picturesque Iron Cove, visit the historic Leichhardt Town Hall, or explore the vibrant shopping and dining precincts of Balmain Road. With its cosmopolitan atmosphere, rich history, and easy access to the city, this desirable location is perfect for those seeking a balance of lifestyle and convenience.",825000,320,Available
1,Bungalow 4BHK,"22-24 Montague Street, Potts Point NSW 2011, Australia. The area is known for its vibrant atmosphere, with trendy cafes and restaurants lining the streets. Potts Point is a bustling hub of activity, with a mix of old and new architecture. The neighborhood is home to a diverse range of people, from young professionals to families and retirees. The area is also close to popular attractions like the Royal Botanic Garden and Mrs. Macquarie's Chair. It's a great place to experience the best of Sydney's culture and lifestyle.",825000,210,Available
1001,Bungalow 4BHK,"Sydney's picturesque Northern Beaches, located at 34 The Esplanade, Mona Vale NSW 2103, overlooking the serene Pittwater. The area boasts an array of outdoor activities, from sailing to hiking, while the vibrant Mona Vale village is just a short stroll away. The tranquil atmosphere, coupled with the stunning ocean views, makes this a perfect haven for those seeking a serene and idyllic lifestyle.",1025000,450,Available
1,Bungalow 5BHK,"The historic coastal town of Port Arthur in Tasmania's south-east, known for its 19th-century penal settlement and a collection of restored convict-era buildings, is a must-visit destination for anyone interested in Australian history. The scenic coastal views, pristine beaches, and rugged wilderness make it a perfect getaway for nature lovers. The charming town offers a range of accommodation options, from luxury hotels to cozy bed and breakfasts, and a variety of restaurants serving fresh seafood and local produce. Visitors can explore the historic site, take a boat tour, or simply enjoy the stunning scenery and relaxed atmosphere. The town's unique blend of history, culture, and natural beauty makes it a truly unforgettable experience.",825000,250,Available
1,Bungalow 5BHK,"A beautiful 5-bedroom house located in the heart of Melbourne, with stunning views of the city skyline and easy access to public transport and local amenities. The house features high ceilings, large windows, and a spacious living area perfect for entertaining. The backyard is fully fenced and has a large patio area perfect for outdoor dining and BBQs. The property is situated in a quiet neighborhood with a strong sense of community and is close to parks, schools, and shopping centers. The house is a perfect blend of modern style and traditional charm, making it an ideal choice for families, professionals, and investors alike.",825000,320,Available
2,Bungalow 5BHK,"The historic coastal town of Byron Bay, situated in the Northern Rivers region of New South Wales, Australia, is renowned for its laid-back surfer vibe, pristine beaches, and stunning sunrises. This charming town is a haven for those seeking a relaxed coastal lifestyle, with its picturesque main street lined with boutique shops, art galleries, and restaurants. Byron Bay is also a popular destination for outdoor enthusiasts, with its nearby national parks, waterfalls, and scenic hiking trails.",1020000,550,Available
7,Bungalow 5BHK,"The picturesque town of Port Fairy, situated in the southwestern part of Victoria, Australia, is a haven for those seeking a tranquil coastal lifestyle. Nestled between the Great South Coast and the rolling hills of the Grampians, this charming town boasts a rich history, vibrant arts scene, and a strong sense of community. With its pristine beaches, scenic coastal walks, and picturesque fishing village, Port Fairy is the perfect destination for those looking to escape the hustle and bustle of city life and reconnect with nature. The town's historic architecture, including its 19th-century cottages and quaint shops, adds to its charm and character. Whether you're a foodie, an art lover, or simply looking for a relaxing getaway, Port Fairy has something for everyone. Its unique blend of natural beauty, rich history, and cultural attractions makes it an ideal place to call home.",825000,450,Available
1001,Bungalow 5BHK,"The iconic Sydney Opera House is situated in the heart of Sydney Harbour, surrounded by the bustling city of Sydney, New South Wales. The picturesque Bondi Beach is a short drive away, offering breathtaking views of the Pacific Ocean. This stunning location is perfect for those who want to experience the best of Australian culture and lifestyle.",1025000,500,Available
1002,Bungalow 5BHK,"The property is situated in a serene and picturesque area of Byron Bay, surrounded by lush green forests and overlooking the crystal-clear waters of the Pacific Ocean. The location is perfect for nature lovers and those seeking a peaceful retreat from the hustle and bustle of city life. The area is also close to the famous Cape Byron Lighthouse, which is the easternmost point of Australia. Visitors can enjoy a range of outdoor activities such as hiking, surfing, and whale watching. The property is also within walking distance to the town's central shopping district, cafes, and restaurants. The scenic coastal route is just a short drive away, offering breathtaking views of the coastline and surrounding landscape.",825000,450,Available
123456,Bungalow 4BHK,"Melbourne's inner-city suburb of Carlton, located near the famous Lygon Street and the University of Melbourne. Carlton is a vibrant and eclectic area, known for its historic architecture, cultural diversity, and lively atmosphere. It's a popular destination for foodies, with a wide range of restaurants and cafes serving everything from traditional Italian cuisine to modern Australian fare. Visitors can explore the beautiful Royal Exhibition Building, a UNESCO World Heritage Site, or take a stroll along the picturesque Carlton Gardens. The area is also home to the Melbourne Museum, which showcases the city's rich history and culture. With its unique blend of history, culture, and entertainment, Carlton is a must-visit destination for anyone exploring Melbourne.",AUD 1200000,250,Available
1,Bungalow 4BHK,"Sydney, New South Wales, Australia. The city is known for its iconic landmarks such as the Sydney Opera House and the Harbour Bridge. Sydney is also famous for its beautiful beaches, including Bondi Beach and Manly Beach. The city has a diverse population and a thriving cultural scene, with many museums, galleries, and festivals throughout the year. Sydney is a popular tourist destination and a great place to live, work, and raise a family. It offers a great quality of life, with a strong economy, good education system, and a wide range of outdoor activities and amenities. The city is also home to many world-class universities, including the University of Sydney and the University of New South Wales. Sydney is a great place to visit or live, with its stunning natural beauty, rich history, and vibrant culture.",850000,240,Available
P00123,Bungalow 4BHK,"Sydney, New South Wales, Australia. 123 Main St, located in a quiet neighborhood surrounded by beautiful parks and gardens. This property is perfect for families, offering ample space for kids to play and relax. The neighborhood is also close to schools, shopping centers, and public transportation. The property itself is a stunning 4-bedroom, 3-bathroom bungalow with a spacious living area and a fully equipped kitchen. The backyard is a tranquil oasis, complete with a swimming pool and a BBQ area. The property is fully furnished and equipped with all the modern appliances you need to live comfortably. It's the perfect place to call home, whether you're a family or a professional looking for a quiet retreat. The property is situated in a safe and secure neighborhood, with 24-hour security and ample parking. The area is also known for its beautiful beaches, parks, and outdoor recreational activities, making it the perfect place to enjoy the Australian lifestyle. The property is available for immediate occupation and is priced at AU$850000. It's a must-see for anyone looking for a luxurious and comfortable living experience in Sydney.",850000.00,2500,Available