Property ID,Property Type,Location,Price,Size,Status
1,Bungalow 5BHK,"In a picturesque region of New South Wales, surrounded by lush greenery and overlooking the serene waters of the Hawkesbury River. Located near the town of Wisemans Ferry, this beautiful bungalow is a perfect blend of tranquility and adventure. The area is known for its rich history, stunning landscapes, and diverse wildlife. Visitors can explore the nearby historic sites, enjoy water sports on the river, or take a scenic drive through the rolling hills and valleys. With its unique blend of natural beauty and cultural heritage, this location is a true gem of Australia.",825000,3200,Available
2,Bungalow 5BHK,"Melbourne's vibrant Fitzroy neighborhood, known for its eclectic mix of 19th-century Victorian-era homes, trendy cafes, and boutique shopping. The area is a hub for Melbourne's arts and cultural scene, with numerous galleries, museums, and performance venues. The neighborhood's vibrant atmosphere is further enhanced by its proximity to the city center, making it an ideal location for those who want to experience the best of Melbourne's urban lifestyle. With its rich history, cultural attractions, and modern amenities, Fitzroy is a highly sought-after suburb that offers something for everyone.",AUD 1200000,250,Available
1001,Bungalow 4BHK,"Located in the heart of Sydney, this stunning property boasts breathtaking views of the iconic Sydney Opera House and the Harbour Bridge. It features a spacious living area with floor-to-ceiling windows, perfect for taking in the sights and sounds of the city. The kitchen is fully equipped with modern appliances and ample storage space. The four bedrooms are tastefully decorated and offer plenty of natural light. With its prime location and luxurious amenities, this property is the perfect choice for those who want to live in the heart of the action.",950000,2500,Available
1,Bungalow 5BHK,"In the heart of Sydney lies the picturesque suburb of Neutral Bay, offering breathtaking views of the Sydney Harbour Bridge and the iconic Opera House. This stunning location is a haven for those who appreciate the beauty of nature and the convenience of city living.",850000,2000,Available
1,Bungalow 5BHK,"Sydney's famous Bondi Beach, Australia is known for its vibrant culture and diverse community. Located in the heart of the city, Bondi Beach is a popular tourist destination that attracts visitors from all over the world. The area is home to a variety of restaurants, cafes, and shops, making it a great place to live, work, and play. With its stunning beaches, scenic coastal walks, and lively atmosphere, Bondi Beach is the perfect place to call home. Whether you're looking for a relaxing beach lifestyle or an exciting urban experience, Bondi Beach has something for everyone.",850000,220,Available
7,Bungalow 4BHK,"The picturesque town of Margaret River, situated in the heart of Western Australia. This charming area is known for its pristine beaches, rugged coastline, and rolling hills. Nestled in a quiet neighborhood, the property offers a tranquil atmosphere, perfect for those seeking a peaceful retreat. The region is also famous for its world-class wineries, gourmet restaurants, and scenic hiking trails. With its unique blend of natural beauty and luxury living, Margaret River is an ideal destination for those seeking a relaxing and rejuvenating experience.",825000,250,Available
1001,Bungalow 5BHK,"Perth, Western Australia, located near the Swan River and its picturesque parks and gardens, offering a serene and peaceful atmosphere, with its stunning river views, scenic walking trails, and a variety of local cafes and restaurants to explore. The area is also close to the city centre, with its vibrant cultural scene, shopping districts, and public transportation links. With its excellent schools, healthcare facilities, and community amenities, Perth is an ideal place to live, work, and raise a family. The climate is mild, with warm summers and cool winters, making it perfect for outdoor activities and enjoying the great Australian lifestyle. ",925000,2500,Available
1001,Bungalow 5BHK,"Melbourne's historic Richmond precinct, nestled between the picturesque Yarra River and the vibrant Bridge Road shopping strip. The area is a melting pot of cultures, with a thriving food scene, boutique stores, and a rich history. Richmond's iconic Punt Road Oval is just a short stroll away, offering breathtaking views of the city skyline. With its blend of old and new, Richmond is a sought-after destination for those who crave the best of Melbourne's lifestyle and amenities.",825000,220,Available
12345,Bungalow 5BHK,"In a coastal town of Byron Bay, with pristine beaches and lush greenery surrounding the property, creating a serene atmosphere.",850000,2500,Available
1,Bungalow 5BHK,"Sydney, New South Wales, Australia - 45-47 Raglan St, Marrickville NSW 2204. This area is known for its vibrant atmosphere, historic architecture, and cultural events. Residents can enjoy a mix of trendy cafes, restaurants, and boutique shops. The nearby Marrickville Park offers a peaceful escape with walking trails and a playground for kids. The area is also well-connected to the city center via public transport, making it an ideal location for professionals and families alike. The local community is diverse and welcoming, with a strong sense of neighborhood spirit. The property itself is a stunning 5-bedroom bungalow with high ceilings, large windows, and a spacious backyard perfect for outdoor entertaining. The interior design is modern and sleek, with a neutral color palette and plenty of natural light. The property has been meticulously maintained and is ready for its new owners to move in and make it their own.",825000,220,Available
1,Bungalow 5BHK,"The property is situated in the heart of Sydney, overlooking the beautiful Sydney Harbour. It boasts stunning views of the iconic Opera House and Harbour Bridge. The residence is a short drive from the bustling city centre, with easy access to public transport, shops, and restaurants. The property is perfect for those who want to experience the best of Sydney's lifestyle and scenery.",950000,4000,Available
7,Bungalow 4BHK,"44 Gordon Street, Glen Iris, Melbourne, Victoria, Australia. The Glen Iris property is situated in the heart of Melbourne's leafy eastern suburbs, offering a serene and peaceful lifestyle. The property is close to local parks, shopping centers, and public transportation. Residents can enjoy easy access to Melbourne's CBD, universities, and other attractions. The area is known for its tree-lined streets, historic homes, and vibrant community. Glen Iris is a highly sought-after suburb with excellent schools, parks, and recreational facilities. The property is perfect for families, professionals, and retirees alike, offering a relaxed and enjoyable lifestyle in a beautiful setting. The Glen Iris property is a rare find, offering a unique blend of natural beauty, convenience, and lifestyle. Residents can enjoy a range of activities, including walking, cycling, and exploring the local parks and gardens. The property is also close to the Yarra River, offering scenic views and opportunities for boating and fishing. With its stunning natural setting, excellent amenities, and convenient location, the Glen Iris property is a must-see for anyone looking for a peaceful and enjoyable lifestyle in Melbourne's eastern suburbs.",525000,245,Available
12345,Bungalow 5BHK,"The picturesque town of Byron Bay, nestled in the heart of New South Wales, Australia. Byron Bay is a popular tourist destination known for its stunning beaches, lush rainforests, and vibrant cultural scene. With a rich history dating back to the 19th century, the town has evolved into a thriving community that offers a unique blend of relaxation and adventure. Visitors can explore the historic Main Beach, visit the iconic Cape Byron Lighthouse, or take a whale-watching tour to spot humpback whales in their natural habitat. Byron Bay is a must-visit destination for anyone looking to experience the best of Australia's coastal lifestyle.",825000,250,Available
12345,Bungalow 5BHK,"The picturesque coastal town of Byron Bay, nestled in the beautiful region of New South Wales, Australia. Byron Bay is known for its stunning beaches, vibrant culture, and eco-tourism activities. Visitors can enjoy whale watching, snorkeling, or simply take a leisurely stroll along the beach. Byron Bay has a strong focus on sustainability and wellness, with numerous health food cafes, yoga studios, and eco-friendly accommodations. The town's laid-back atmosphere makes it an ideal destination for those seeking a relaxing getaway from the hustle and bustle of city life. With its rich history, diverse wildlife, and breathtaking scenery, Byron Bay is a must-visit destination for any traveler. ",825000,250,Available
1,Bungalow 4BHK,"123 Smith Street, Fitzroy, Melbourne VIC 3065. Fitzroy is a vibrant and eclectic suburb in Melbourne's inner north. It's known for its bohemian vibe, street art, and trendy cafes. The area is surrounded by parks and gardens, including the iconic Fitzroy Gardens, which feature stunning architecture and beautiful tree-lined avenues. Fitzroy is a popular destination for foodies, with a wide range of restaurants, bars, and cafes serving everything from traditional Australian cuisine to international flavors. Visitors can explore the suburb's many boutiques, art galleries, and vintage shops, or take a stroll along the nearby Yarra River. Whether you're looking for a relaxing day out or an action-packed adventure, Fitzroy has something for everyone. With its rich history, cultural attractions, and natural beauty, Fitzroy is a must-visit destination in Melbourne's inner north. The area is easily accessible by public transport, with several tram and train lines running through the suburb. Fitzroy is a great place to live, work, and play, with its friendly community, excellent schools, and plenty of amenities. Whether you're a local or just visiting, Fitzroy is a place that will leave you feeling inspired and connected to the community.",825000,250,Available
2,Bungalow 5BHK,"The property is situated in the picturesque town of Margaret River, Western Australia. The town is known for its stunning beaches, world-class wineries, and vibrant arts scene. It is a popular destination for tourists and locals alike, with its natural beauty and relaxed atmosphere making it an ideal place to live. The property itself is nestled in a quiet cul-de-sac, surrounded by lush greenery and just a short walk from the town centre. The area is serviced by a variety of shops, restaurants, and cafes, making it easy to access all the amenities you need without having to venture far. The property is perfect for those looking for a peaceful and convenient lifestyle in a beautiful part of the world.",850000,250,Available
10001,Bungalow 5BHK,"Sydney's picturesque suburbs, offering a serene and peaceful atmosphere with stunning views of the surrounding landscape, featuring lush greenery and picturesque walking trails that wind through the hills, and a variety of wildlife that inhabit the area, including birds, kangaroos, and koalas. The location is also close to local shops, restaurants, and amenities, making it an ideal choice for families and professionals alike.",850000,250,Available
1001,Bungalow 5BHK,"The address is located in the heart of the vibrant city of Sydney, in the state of New South Wales. The area is known for its stunning beaches, scenic coastal walks, and diverse cultural events. The residents of this area enjoy a high quality of life, with easy access to public transportation, shopping centers, and top-rated schools. The climate is mild, with warm summers and cool winters, making it an ideal location for people of all ages. Residents can explore the famous Sydney Opera House, visit the iconic Bondi Beach, or take a scenic drive along the picturesque coastline. The area is also home to a diverse range of restaurants, cafes, and shops, offering a unique blend of Australian and international cuisine. With its beautiful scenery, rich history, and modern amenities, this location is a perfect place to call home. The area is also close to several parks and nature reserves, offering plenty of opportunities for outdoor activities, such as hiking, cycling, and picnicking. Whether you're looking for a relaxing getaway or an exciting urban experience, this location has something for everyone.",825000,2500,Available
1001,Bungalow 5BHK,"Located in the heart of Sydney, Australia, this stunning 5BHK bungalow boasts breathtaking views of the iconic Sydney Harbour Bridge and the picturesque Sydney Opera House. With its unique blend of modern and traditional architectural styles, this property is a true masterpiece. The interior is flooded with natural light, and the expansive living areas offer the perfect space for relaxation and entertainment. The property also features a spacious backyard with a private swimming pool and a beautifully manicured garden. The location is perfect, with easy access to the city centre, public transport, and popular amenities such as restaurants, cafes, and shopping centres.",AUD 2500000,3000,Available
1001,Bungalow 5BHK,"A secluded beachside villa in Byron Bay, with breathtaking views of the Pacific Ocean and surrounding lush tropical rainforest.",AUD 2500000,1200,Available
1,Bungalow 4BHK,"The historic city of Melbourne, nestled in the southeastern part of the Australian state of Victoria, is a vibrant cultural hub with a rich history dating back to the 19th century. The city's iconic landmarks include the Royal Botanic Gardens, the National Gallery of Victoria, and the Melbourne Cricket Ground. Visitors can stroll along the Yarra River, explore the city's street art scene, or visit the famous Queen Victoria Market for a taste of local produce and handmade crafts. Melbourne is also a haven for foodies, with a diverse range of cuisines and restaurants to suit every palate. Whether you're interested in history, culture, or simply enjoying the great outdoors, Melbourne has something for everyone.",850000,250,Available
2,Bungalow 5BHK,"In a picturesque town in New South Wales, surrounded by lush greenery and overlooking the serene waters of Lake Macquarie, is a stunning 5-bedroom bungalow. The property boasts a spacious open-plan living area, complete with a large kitchen and dining space that flows seamlessly into a comfortable lounge room. The home also features a spacious master bedroom with an expansive walk-in wardrobe and an ensuite bathroom. The additional four bedrooms are serviced by a modern family bathroom and a separate toilet. The property is set on a 1200 square meter block of land, offering ample space for a pool, gardens, and a double garage. The location is perfect for those who want to be close to the action but still enjoy a peaceful and private lifestyle. The property is within walking distance to local shops, cafes, and restaurants, and is only a short drive to the nearby beaches and scenic coastal walks.",850000,1200,Available
1,Bungalow 4BHK,"The location is situated in the heart of Sydney, surrounded by lush greenery and offering breathtaking views of the harbor. The area is known for its vibrant cultural scene, with numerous restaurants, cafes, and art galleries nearby. Residents can enjoy a stroll along the picturesque waterfront, visit the famous Sydney Opera House, or take a ferry to nearby Manly Beach. The location is also conveniently close to major shopping centers, schools, and hospitals, making it an ideal choice for families and professionals alike. Furthermore, the property is situated in a quiet and secure neighborhood, ensuring a peaceful and comfortable living experience.",850000,200,Available
1001,Bungalow 4BHK,"Situated in the picturesque Blue Mountains, New South Wales, Australia, this stunning property boasts breathtaking views of the Jamison Valley. The location offers a serene and peaceful atmosphere, perfect for those seeking a tranquil retreat from the hustle and bustle of city life. With its close proximity to the Three Sisters rock formation, shopping centers, and other local attractions, this property provides the ideal blend of seclusion and convenience. The property itself is a beautifully crafted 4-bedroom bungalow, offering ample space for a large family or group of friends to relax and unwind. The interior features a stylish and modern design, complete with high ceilings, large windows, and a spacious open-plan living area. The property also boasts a large outdoor entertaining area, perfect for alfresco dining and socializing. Whether you're looking for a permanent residence or a holiday home, this property is sure to impress.",825000,250,Available
1,Bungalow 5BHK,"A secluded beachside resort in Byron Bay, New South Wales, Australia, surrounded by lush rainforests and crystal-clear waters. The property boasts an expansive 3500 square meter land area, complete with a private beach, swimming pool, and an array of tropical trees. The nearby town offers a range of restaurants, cafes, and shops, while the famous Cape Byron Lighthouse is just a short drive away. Byron Bay is known for its stunning natural beauty, vibrant arts scene, and relaxed atmosphere, making it the perfect destination for those seeking a peaceful and rejuvenating getaway.",5250000,3500,Available
1,Bungalow 4BHK,"In a lush 12-acre property nestled in the picturesque town of Daylesford, Victoria, Australia, a serene haven awaits. The town is renowned for its natural hot springs, historic architecture, and vibrant arts scene. Surrounded by rolling hills and verdant forests, this secluded retreat offers a tranquil escape from the hustle and bustle of city life. Daylesford is a popular tourist destination, attracting visitors from all over the world with its unique blend of natural beauty and cultural charm.",1200000,400,Available
1001,Bungalow 5BHK,"Sydney's scenic Northern Beaches, located in the picturesque suburb of Mona Vale, is a coastal paradise offering a relaxed atmosphere and breathtaking ocean views.",AUD 1200000,450,Available
1,Bungalow 4BHK,"The house is situated on a quiet street in the heart of Melbourne, overlooking the picturesque Yarra River. The area is known for its vibrant cultural scene, with numerous art galleries, museums, and performance venues. In addition, the neighborhood offers easy access to public transportation, shopping centers, and a variety of dining options. The local community is friendly and welcoming, making it an ideal place to call home. The nearby Royal Botanic Gardens provide a peaceful escape from the hustle and bustle of city life, offering stunning views of the city skyline and a chance to connect with nature.",825000,250,Available
1,Bungalow 4BHK,"The property is situated in a tranquil and picturesque region of rural Victoria, Australia, with lush rolling hills, verdant pastures, and a serene atmosphere. The location is perfect for those seeking a peaceful retreat from the hustle and bustle of city life. The nearby town of Kyneton offers a range of amenities, including shops, restaurants, and cafes, making it an ideal spot for both relaxation and exploration.",525000,1200,Available
1,Bungalow 4BHK,"Sydney's picturesque Northern Beaches, near the famous Palm Beach, offers a tranquil atmosphere and breathtaking views of the Pacific Ocean. The area is known for its laid-back surf culture and stunning beaches, making it an ideal location for those seeking a relaxed coastal lifestyle. The nearby town of Avalon provides easy access to shopping, dining, and entertainment options, while the scenic coastal walk offers a picturesque route for exploring the area's natural beauty. With its unique blend of relaxation and activity, Sydney's Northern Beaches is the perfect destination for those looking to escape the hustle and bustle of city life and connect with nature.",825000,250,Available
1,Bungalow 4BHK,"The property is situated in a picturesque suburb of Sydney, overlooking the beautiful Royal National Park. This area is known for its stunning beaches, lush greenery, and diverse wildlife. It's a perfect place to escape the hustle and bustle of city life and connect with nature.",850000,2500,Available
1,Bungalow 5BHK,"Sydney, New South Wales, Australia. The location is known for its iconic Opera House and Harbour Bridge. Sydney is a culturally and ethnically diverse city with a strong economy and high standard of living. It is home to many world-class universities, museums, and galleries. The city is also famous for its beautiful beaches, such as Bondi Beach and Manly Beach, which are popular tourist destinations. Sydney is a melting pot of cultures, with a strong presence of Asian, European, and Indigenous Australian communities. The city's cuisine is a reflection of its diverse cultural heritage, with popular dishes including Chinese stir-fries, Italian pasta, and traditional Australian barbecues. Sydney is a vibrant and exciting city that offers something for everyone, whether you're interested in history, culture, food, or outdoor activities.",850000,250,Available
12345,Bungalow 5BHK,"Sydney, New South Wales, Australia
The property is situated in a prime location with breathtaking views of the harbour.
It's a short walk to the city centre, with access to public transport, shopping, and dining.
The area is known for its beautiful parks, beaches, and vibrant cultural scene.
Residents can enjoy a range of amenities, including a fitness centre, swimming pool, and BBQ area.
It's an ideal place to live for those who want to be close to the action but still have a sense of community.

This stunning property is a rare find in one of the most sought-after suburbs in Sydney.
With its modern design, spacious living areas, and high-quality finishes, it's sure to impress.
The property features a spacious living room, gourmet kitchen, and four generous bedrooms.
The master bedroom has an en-suite bathroom and a large walk-in wardrobe.
The property also has a double garage and a private courtyard.
It's the perfect home for a family or professional looking for a stylish and comfortable living space.

The property is available for immediate sale and is priced competitively at $1200000.
Don't miss out on this incredible opportunity to own a piece of Sydney's real estate history.
Contact us today to arrange a viewing.",1200000.00,250,Available
1,Bungalow 4BHK,"The picturesque Blue Mountains region in New South Wales, Australia, with breathtaking views of the Jamison Valley. Located near Katoomba, this area is known for its vibrant arts scene and a range of outdoor activities, including hiking and rock climbing. The region's unique landscape has been shaped by millions of years of erosion, creating a diverse range of flora and fauna. Visitors can explore the Three Sisters rock formation, the Scenic Railway, and the Skyway for panoramic views.",850000,250,Available
1,Bungalow 5BHK,"Melbourne's vibrant inner-city suburb of Fitzroy, known for its beautiful parks and gardens, eclectic cafes, and thriving arts scene. Fitzroy is a popular destination for tourists and locals alike, offering a unique blend of Victorian-era architecture, boutique shopping, and world-class dining. The suburb is also home to the famous Brunswick Street, lined with restaurants, bars, and live music venues. Whether you're looking for a relaxing stroll through the gardens or a lively night out, Fitzroy has something for everyone.",825000,220,Available
7,Bungalow 4BHK,"Located in the heart of Sydney, Australia, 123 Main Street, New South Wales. This beautiful property is situated in a quiet neighborhood, surrounded by lush greenery and offers a serene atmosphere for its residents. The property boasts of a spacious living room, a well-equipped kitchen, and four spacious bedrooms, each with its own attached bathroom. The property is perfect for a family or a group of friends looking for a comfortable and peaceful living experience. The location is easily accessible by public transportation and is close to various amenities like shopping centers, restaurants, and entertainment hubs. The property is available for immediate possession and is priced at $1200000. The property size is 2500 square meters. The property status is Available.",$1200000,2500,Available
12345,Bungalow 5BHK,"The scenic coastal town of Byron Bay in New South Wales, Australia, is renowned for its laid-back surfer vibe and natural beauty. Nestled in a quiet cul-de-sac, this stunning 5-bedroom bungalow boasts expansive ocean views, a private pool, and lush tropical gardens. As you step inside, you'll be greeted by high ceilings, spacious rooms, and an abundance of natural light. The kitchen is a culinary delight, featuring sleek appliances, ample storage, and a breakfast nook perfect for starting your day. With its perfect blend of relaxation and entertainment, this property is an absolute must-see for anyone seeking a tranquil retreat in a picturesque setting. The local beach is just a short stroll away, offering endless opportunities for swimming, surfing, and sunbathing. The nearby town centre is home to a variety of shops, restaurants, and cafes, catering to all tastes and preferences. Whether you're looking for a permanent residence or a holiday home, this incredible bungalow is sure to impress.",825000,350,Available
